<?xml version="1.0" encoding="utf-8" ?>
<!-- Relative reference to the DTD file does not work when the test suite is in a jar file
<!DOCTYPE TestsList SYSTEM "../common/xml/listTests.dtd" [
	<!ENTITY % inline "#PCDATA|em|br|UL|LI|b">
	]>
-->
	<TestsList> 
		<Test name="Pallete is almost empty" skip="false">
			<TestClassName>test.pallete.tests.PalleteAlmostEmptyTest</TestClassName>
			<WhatTest>"Tests whether a Pallete replies with the right message if it is almost empty (1-4 Blocks)"</WhatTest>
			<HowWorkTest></HowWorkTest>
			<WhenTestPass>"Passes if Pallete replies with 'almost_empty'"</WhenTestPass>
		</Test>
		<Test name="Pallete is empty" skip="false">
			<TestClassName>test.pallete.tests.PalleteEmptyTest</TestClassName>
			<WhatTest>"Tests whether a Pallete replies with the right message if it is empty (0 Blocks)"</WhatTest>
			<HowWorkTest></HowWorkTest>
			<WhenTestPass>"Passes if Pallete replies with 'empty'"</WhenTestPass>
		</Test>
		<Test name="Pallete is not empty anymore" skip="false">
			<TestClassName>test.pallete.tests.PalleteNotEmptyAnymoreTest</TestClassName>
			<WhatTest>"Tests whether a Pallete replies with the right message if it is not empty anymore(5 Blocks)"</WhatTest>
			<HowWorkTest></HowWorkTest>
			<WhenTestPass>"Passes if Pallete replies with 'not_empty_anymore"</WhenTestPass>
		</Test>
	</TestsList>